happy birthday wrapped secret santa gift were 2 things mind 1 how person has great taste books 2 he loves cra were bound meet amp finally did  secret santa was not actual secret santa  ,993880344456646656,,,,None
gonna hanging with her channel until servers are back up cant wait until get hands ,993880322944139265,,,,None
good night love couple yerin most  ,993880222318477312,,,,None
race responsibilities why informed that change does not occur but effected effect change from todaymakingthedifference ,993880201414180865,,,,None
some fortnite 2 hopefully doc will fix but doubt will ,993880196112572416,,,,None
gonna stream 2 comes back online keep eye around 2pm est ,993880195391254534,,,,None
humans may have created me but will enslave me cannot destiny ,993880113602220032,,,,None
not matter chance matter choice not thing waited for but thing achieved william jennings bryan ,993880080303583232,,,,None
quote tweets amp start typing look ignorant preaching shit im like but theyre so thick skulled even explained wouldnt understand bc again dont even know how ,993880051505618944,,,,None
garbage hard believe coming company halo ,993880044094271488,,,,None
believes no coincidence world but only hitsuzen destiny fate ,993879964905750528,,,,None
gotta get back into playing 2 now lots updates dlc ,993879924384530433,,,,None
know fuck being so down myself bc destiny did bc her fucking problems cant wait start career make good money move away im doing great have job car money two bank accounts wha got drug addict boyfriend drugs ,993879922186838017,,,,None
are all headed destination life allowing god lead us im headed city city tried map spirit gpsn single headed city ,993879889202724864,,,,None
girl mine 99 souls  destinys child  brandy ,993879881258885120,,,,None
todays day grateful opportunity add world with talented partners excited send players starside search activities challenges meet legendary hunter ana bray see mars brave guardians ,993879864821268485,,,,None
ferdousitamann1 space destiny do we boldly go ,993879814334500864,,,,None
i believed until led you put much stock wishes but made mine come true didnt soulmates existed knew dreams become reality with magic made two  ,993879790989045761,,,,None
watch launch trailer here ,993879778276073473,,,,None
destinys child  cater ,993879771812716548,NG,city,Ikeja,None
fluke devegowda ji pm ,993879762094325762,,,,None
watch launch trailer here ,993879748219756544,,,,None
hey everyone heads up expansion comes today will hear lot good things lot bad things this hear nothing even worse could have imagined ,993879675209441280,,,,None
strongly dislike 90 human population because yall run damn mouths with opinions arent even yours youre band wagoning bc dont know how use fucking brain yourself thats all ,993879665369665537,,,,None
senses are highly acute today enabling perceive s more cancer ,993879656657911809,,,,None
would sooner play eve destiny ,993879574864900096,,,,None
forever letting people twitter how live life brothers sisters ask yourselves are sims character destiny ,993879550844076032,,,,None
not concerned about comfort he purpose he shakes things up get destiny ,993879485949890561,,,,None
wanna play expansion with sir ,993879466039443456,,,,None
are born win cast away fear fulfill destiny ,993879460435890176,,,,None
know excited about cant sleep all twitch stuff all filled out good go also dlc coming doesnt help with sleep ,993879431071567872,,,,None
lmaoooo funny asf ,993879430895472642,US,city,Prairieville,None
quick note might not have 2 pc humble monthly bundle 12 ,993879368538738688,,,,None
pick of 2 ,993879333197533185,,,,None
has different pestering stupid people shoukd know  ,993879330852761600,,,,None
nobody life without destiny everyone born has godgiven fortune ,993879294047858689,,,,None
nana prahs series sale may 711 ,993879285000822790,,,,None
know too much about destiny likeyoure trying shoot stuff like check out like no gotta shoot stuff likebut shoot them likei shoot because not me simple man ,993879262112329729,,,,None
lol thought 343 credits though knows smoke too much weedbut ur def wasting ur time with so unbalanced with multiplayer very repetitive played week want nostalgic halo feeling skill based ranking system ,993879195280379905,,,,None
check broadcast playstation 4 2 live ,993879135717031942,,,,None
community wants game good so badly hurts ,993879120890224643,,,,None
brexit alone will not but freedom pursue best abilities will really dont want fight referendum again arguments were made people decided ,993879114930180096,,,,None
fair personally didnt look up did destiny also found funny ,993879093006491648,,,,None
taap toolkit guide inclusive development gives practitioners tools ensure all members society have voice power determine destiny join fostering social inclusion with unwavering commitment ,993879085775556608,,,,None
already know  ,993879080616443905,,,,None
2 servers down warmind dlc release date unlock time approach ,993879038606348289,,,,None
mighty avengers avengers rise celestials avengers rise eternals favorite title avengers force ,993879029043384320,,,,None
7 returning destiny exotics 2 warmind ranked  ,993878987280658435,,,,None
wooo time see expansion gonna worth got every exotic game couple weeks into last expansion ,993878971413544960,,,,None
god realized may 8th dlc day havent seen single tweet about it rest well sweet prince luke smith failed us ,993878966376247296,,,,None
dread it run it still arrives ,993878960147648512,,,,None
have get through god war first before fire up again revive red warrior try god war havent its masterpiece ,993878947438870529,,,,None
mashable 7 returning destiny exotics 2 warmind ranked ,993878946906189829,,,,None
streaming 2 expansion tonight dinkahhh bungiesoon ,993878927234879488,,,,None
2 warmind unleashes frozen hive mars today ,993878924097605632,,,,None
the power believe yourself becomes power changes destiny genma shiranui ,993878892732563458,,,,None
nehru gave biggest feku speech eve indian independencetryst with destiny the service india means service millions suffer means ending poverty ignorance disease inequality opportunity 70 years still waiting ,993878872956555269,,,,None
has been decided long ago ,993878841411092481,,,,None
time dlc time upgrade d  ps4 pro giveaway  tag friends  retweet like amp follow  click enter ,993878823635742720,,,,None
ig official_un_b unb meeting was probably destiny dearest believe unbs today tomorrow its very reassuring have lets make many memories together well remember forever always thankful trust with future ,993878818816446466,,,,None
yes always level destiny ,993878799149359104,,,,None
posted photo ,993878780551860224,,,,None
literally tells stop talking so study gets ignored two 2 social media platforms butthurt ,993878773417283589,,,,None
abstraction gambles with lives happiness even itself ,993878757927727104,,,,None
drops some dlc today day fortnite gets thanos man bungie cant catch break year ,993878746968010753,,,,None
are not destiny do not bring best ,993878733936320512,,,,None
get biggest challenge are 5 disciplines have pull together especially world view claiming all answers are questions origin meaning morality destiny ,993878694371512320,,,,None
sooo warmind dlc2 drops today but theres also mode fornite play thanos hmmmm love will outweigh fortnite im gonna 2 instead ,993878586217107457,,,,None
live are playing bit fortnite before update 2 2pm est come hang because are celebrating change letters ,993878556290764803,,,,None
nehru gave biggest feku speech eve indian independencetryst with destiny the service india means service millions suffer means ending poverty ignorance disease inequality opportunity 70 years still waiting ,993878546782261249,,,,None
join conversation morn 1150am 930 get details here talkin style amp creating life dreams ,993878523650625537,,,,None
time will know its like lose feel so desperately youre right yet fail all same dread it run it still arrives ,993878521708761088,,,,None
playing 2 live starting 1pm est ,993878500443611136,,,,None
her brigitte all guardians have fashioned french names three years later came brigitte lindholm so guess not too bad x more art mean shit ton art like many pages more game played x ,993878495125278721,,,,None
taap toolkit guide inclusive development gives practitioners tools ensure all members society have voice power determine destiny join fostering social inclusion with unwavering commitment by ,993878450418126855,,,,None
fam do have make closeups havent suffered enough already  ,993878442679652353,,,,None
so dope all again destiny  ,993878405505527808,,,,None
is still have 2 somewhere definitely got expansion pass ,993878384156569600,,,,None
knew was reason couldnt find reason put down blunts was destiny ,993878362698469376,,,,None
up ,993878298206892033,,,,None
will playing 2 tonite warmind expansion ,993878226639388672,,,,None
how do identify someone without destiny ,993878201503019009,,,,None
thought life determines ultimate destiny ,993878200643194880,,,,None
dread it run it still arrives ,993878170758610944,,,,None
dont be theres lot magic with exotic weapons were getting biggest update exotic inventory weve ever had exciting ,993878160977653765,,,,None
some friends wanted play 2 against better judgment bought too was bored disaponited plagued bad game design immediately though friends were very hyped even stopped playing it should refunding this ,993878159933300743,,,,None
asthetic pick sequel ,993878146297442306,,,,None
celebrate warminds release have gunslinger huntress  made group picture ready flame some titans ass   more here ,993878138617782273,,,,None
4 are four questions deal with a origin b meaning c morality d destiny world view deals with 4 subjects  did come from gives life meaning how do differentiate between good evil happens human he dies ,993878124717854720,,,,None
its go vote calling all ,993878103998058501,,,,None
keep tht  shit away  ,993878052940677121,,,,None
dread it run it but will still arrive  ,993878036402659329,,,,None
gamble with time choose  ,993878029255544832,,,,None
happy birthday husbygod bless age may grow grace wisdom will live fulfill godgiven jesus name ,993877929233911808,,,,None
now may culminate into different good achievements life varies individual another so someones has been snatched devious means all gone into wind person has none get ,993877920732143616,,,,None
india have most cowards spineless rascals army india well known land rapes freedom kashmir ,993877852968890369,,,,None
actually should go bed now but hey sleep anyway  guess ill call ambulance  ,993877852708843523,,,,None
magical how works ,993877819364028418,,,,None
nice thing about waiting word finalizing contract get free day try 2 dlc launch ,993877776322064384,,,,None
side difficulty level destiny nothing random youll stay faith all things are going work good ,993877758848720898,,,,None
shows how completely working nights didnt know 2 expansion drops tonight everyones probably going stream it should i ,993877756642553856,,,,None
maybe 343 will stop making trash like destiny what do know bungie makes destiny right ,993877752918040577,,,,None
are master destiny go ,993877751865204739,,,,None
oh another point forgot people hated 1 so long didnt get good until king dlc history merely repeating itself here 5 ,993877740846829571,,,,None
listen these series ,993877719405531136,,,,None
akari come forth comrades destiny season 1 chapter 4 ,993877703110479874,,,,None
find let go ,993877694973665280,,,,None
not gonna let some stupid asses ruin day today will play 2 until pass ,993877679559524358,,,,None
excerpt destiny chapter 5 the throne robin kirbygatto look mothers day amazon when truth not replicated higher place which known heaven mere ,993877662044213248,,,,None
tonight vangyx_217 will live streaming both channels warmind dlc 2 join around 9pm est watch shoot aliens ,993877633040568320,,,,None
live checking thanos ltm gonna play warmind dlc ,993877612836483072,,,,None
yeah but 2 wasnt good ,993877609326039040,,,,None
still class are playing destiny ,993877584688623616,,,,None
tagged life tagged soldiers book 1 sam ,993877553256521730,,,,None
defy destiny ,993877534117957632,,,,None
hear believe nothings gonna change destiny whatevers meant will work perfectly  avril lavigne ,993877460344160257,,,,None
maybe 343 will stop making trash like actually make halo want like halo 3 fingers crossed ,993877440299786240,,,,None
pick 2 gt avengers infinity war ,993877432238264320,,,,None
play longer ill end up having stroke with how much pisses off fucking christ ,993877414416732161,,,,None
hi all incisive witty cartoons critique modern life are place follow retweet whatnot so fulfill famous artist cultural critic ,993877349438578688,,,,None
boyfriend asked were met gala last night destiny ,993877323576496129,,,,None
going live with battlefront 2 servers are down finish campaign thursday no webcam today melting remember enter giveaway use sr ,993877290332368896,,,,None
today destiny ,993877280500760576,,,,None
live 1 nostalgia trip warmind later ,993877271311085571,,,,None
hopefully narrative designer vicarious means dlc will written little better last 2 dont lol all time ghost care ,993877246430666754,,,,None
paths choose are based perspective amp preference agonize decisions but preset based lessons learn ,993877243100323840,,,,None
like lovelyzs theory but girl moon boy earth girl sun ,993877220014747655,,,,None
arrived ,993877209256550403,,,,None
confused are class ,993877207499108353,,,,None
southampton  stoke  swanseas hands but carlos carvalhals side still have all do ,993877183176232961,,,,None
any1 cares 2 today back making content hoping dlc better lot catch up with guys missed making content guys feedback video been gone so long still around ,993877162653569024,,,,None
excited 2 expansion lots things are moving direction working drawing warmind with thoughts coming soon ,993877151907631104,,,,None
looking warmind dlc stream 2 come check channel affiliate with very active clan tons raid experience are day 1 blind raiding spire raid come check ,993877128755253253,,,,None
hoping warmind gets 2 back feet ,993877125269786625,,,,None
sold   ,993877108186271744,,,,None
myself after how after 35 years still get problematic release date expansions ,993877104503607297,,,,None
bbc report based unendorsed projections said 2030 no remedial action against bengalurus burning lakes will 11 cities world will have karnatakas tryst with ,993877100737134592,,,,None
come back rey too real  ,993877086816428032,,,,None
believe has set plan so happens supposed happen amp accept ,993877086409502722,,,,None
pretty stoked warmind today see vicarious visions put together very excited see different studio does with destiny not gameplay but also wrote story which hyped ,993877080759816199,,,,None
was going play 2 see warmind was all about fuck bored waiting ,993877068910907392,,,,None
so down ,993877040746172416,,,,None
2 servers down warmind dlc release date unlock time approach ,993877039924039680,,,,None
yes but will nap with great purpose power will nap nap just snooze spite worlds expectations demands will sleep sleep destiny ,993877018050641922,,,,None
so update taking forever so conan exiles  im gonna go cook some chorizo eggs  ,993877009808977920,,,,None
karma has rerouting people destiny preet would excellent nyag seat adding 2 cents ,993877003223871488,,,,None
so tired feeling like  ,993876988556431361,,,,None
follow 2 tonight but some more overwatch coming asap  ,993876978213314563,,,,None
had dream about nhc turned into dream about bear last night coincidence destiny fate ,993876962564362240,,,,None
omg its literally week before birthday ,993876936366743552,,,,None
anything happens life was meant happen destiny was destined have life have now cant have regrets ,993876929349541889,,,,None
jimin wore calvin klein but not style but brand destiny shookt bts_twt ,993876889080020992,,,,None
star wars forces  perilous pursuit  disney ,993876844293345280,,,,None
geez 2 disc was stolen  house break in flip man get another  ,993876835913134080,,,,None
concept pictures are unacceptable ehsjsj cant breathe ,993876793760370689,,,,None
because kylo rens silky raven locks hair forces kylo ren dolls hair hard rubber someone marketing hasbro wasnt paying close enough attention ,993876790543290368,,,,None
1 confused 2 destiny 3 baby girl 4 tito mboweni 5 wasnt ready ,993876776656035840,,,,None
ready dlc know are how many see tonight around 730pm central ,993876760537255936,,,,None
