did threw shade was hated you might one but hatred cant stop destiny pray everyone succeed beyond imperfections ,993884837185556481,,,,None
all this have made so many friends with destiny lots love  ,993884836191498240,,,,None
179  game   ps3 ,993884813357699072,,,,None
46 ember ashes sabaa tahir you are full laia full life dark strength spirit are dreams will burn are ember ashes destiny    ,993884812812353536,,,,None
because end day end up playing  ,993884787696979969,,,,None
launch music awesome ,993884760639524865,,,,None
not meant continued ,993884755052576769,,,,None
watched agents shield along with friday night dinner thats back forgot watch so get eat 2 dlc ,993884745636380672,,,,None
 spirit pick up book called the spear destiny by trevor ravenscroft talks about hitler occult how he was obsessed with finding sword pierced christ get blood   ,993884742364758017,,,,None
it decisions not conditions determine destiny  anthony robbins ,993884741316333568,,,,None
2 servers down warmind dlc release date unlock time approach ,993884711280881664,,,,None
ltmay gt written destiny will change no matter how much try to ,993884697834016768,,,,None
been player d1 beta like deej everyone bungie creating destiny cannot wait get stuck into warmind later today with brother guardians will stand together seize becomelegend ,993884697561362432,,,,None
key unlock someone elses destiny are special ,993884681002192896,,,,None
surround with people definition not based history but destiny  ,993884676489207813,,,,None
pussycat dolls  jai ho you are destiny ,993884652925579265,,,,None
road no today ,993884642360070144,,,,None
peace keep thinking will favour done someone returned how revenge wrong done someone must belief allahs hand destiny ,993884635011657728,,,,None
adorable love it tattoo club ,993884634651025408,,,,None
dread it run it still arrives ,993884620298039296,,,,None
free shape without interference ,993884619710885888,,,,None
neighbor sent goat meat pepper soup no reason tastes soo delicious scared eating destiny ,993884615906643968,,,,None
yea but look time germany spain france etc 6pm are getting home work ready play some sweet  ,993884610495840256,,,,None
mr oliver plunkett 100000sqkm 250sqkm48hours job will found mh370will take chance before 90days limitdestinys will guide resting location mh370 bay bengal territoryhard work failure coz act destinys ,993884575297343489,,,,None
its due season sleepingsheepish negroes awaken claim rightful heritage visit learn how grow community defining ourselves claiming heritage taking back prophesied scriptures ,993884561200345088,,,,None
dread it run it arrives all same here should say my spoiler review infinity war is ,993884535749300225,,,,None
dont let moods decide destiny ,993884535157919744,,,,None
exactly may her soul rest peace dont aaliyah could have done beyoncè doing today even was still alive noticed beyoncè drive even was with child ,993884513620123651,,,,None
it mother not warriors create people guide destiny  luther standing bear oglala lakota ,993884508305977347,,,,None
enter 2 ps4 pro giveaway ,993884506498240513,,,,None
destiny alive heaven love innocence always destroy aftermath hell life infinite ,993884506137415681,,,,None
2s warmind expansion launches later today  ,993884496280858625,,,,None
do play destiny ,993884495953641473,,,,None
the future serves mortal destiny ,993884488529739776,,,,None
are born win cast away fear fulfill destiny ,993884488466927616,,,,None
watch nollywood movie tears 1 ,993884483194531840,,,,None
day found was slain good universe guess wont witness arriving after all bummer ,993884474717896704,,,,None
watch nollywood movie tears 2 ,993884464454426625,,,,None
2 expansion ii warmind goes live 7pm bst today ,993884461207994369,,,,None
alright its up you im going play 2 evening with friends ,993884443449397250,,,,None
hmmm may go back today check out ,993884416849178626,,,,None
im waiting anthem fuck destiny ,993884388516655107,,,,None
but price pay calling ,993884371147935745,,,,None
okay so was informed has cantina las vegas literally throw all plans window ive found  ,993884363854000128,,,,None
have sounding more like hick do now all life ive lived vermont tried avoid but cant its destiny ,993884345059479555,,,,None
rule give niggas benefit doubt ,993884344619098112,,,,None
2 servers down warmind dlc release date unlock time approach ,993884336226164736,,,,None
enter 2 ps4 pro giveaway ,993884330664648706,,,,None
no her destiny ,993884330337320961,,,,None
four year beside herself traditional holiday her now finishes heroic public events continuously reminds her mother teach her how destiny excited too  ,993884309172834304,,,,None
dread run it still arrives ,993884303242211328,,,,None
baby sexy free come play with naughty mommy im gt ,993884297034653696,,,,None
decisions shape  wrap mind around  ready start shaping love chat  ,993884260317716486,,,,None
basically come conclusion want take hold destiny means not answering phone calls answering call always changes  someone wants give work wants give information  both scenarios change destiny ,993884255985065994,,,,None
enjoy warmind launch guardians eager get all thoughts had some time with expansion thisll first dlc day 1 miss beautiful scotland ,993884253095124993,,,,None
left house day expansion being released would maybe turning leaf but still plan home unlocks so probably not  ,993884244685574144,,,,None
noona destiny ,993884216357105664,,,,None
less hour go gang should hopefully see expansion redeems 2 ,993884207503069184,,,,None
fortnight till servers are playable fina get sweet victory ,993884200402063361,,,,None
11 hour work day last night so its sleep warmind release 2 thanos fortnite also have moved house within 3 days do do do ,993884190876798976,,,,None
playing some fertnert infinity gauntlet morning possibly heading 2 play warmind dlc  come hang out drop follow have some fun  ,993884175773007872,,,,None
guys streaming dlc drops which will hour two leave later work but back stream after get off ,993884151240511488,,,,None
not gonna lie music 2 dlc had doing monkas little bit ,993884144823304192,,,,None
home early so stream early pubg till 2 servers come up warmind go ,993884131573600257,,,,None
spent 1200 couches did dumb ass get rid had valley mills  ,993884124611072000,,,,None
makes not want get 2 bluhhh ,993884109733687298,,,,None
did not choose work sitecore true believer destiny happened was first project back 2012 was asked work sitecore still remember early days learning sitecore do not want change thing lt3sitecore ,993884089483575297,,,,None
gonna stream some 2 before class sadly without mic having being dropped off tonight ,993884073318903808,,,,None
excellence accident represents wise choice many alternatives choice not chance determines destiny ,993884052481626112,,,,None
anyone elses 2 download 129gb apparently meant 6gbish ,993884049621086208,,,,None
david gerner maanum were interviewed during adapted bowling tourney asked joined bowling both replied because love being team love cheer teammates reminding all about ,993884032399282178,,,,None
weve invented because cant stand fact everything happens accidental ,993884018927022081,,,,None
tenacious announce sequel pick ,993884014921568257,,,,None
was going pick two people ,993884008101679105,,,,None
today going work some alternate characters 2 have only started hunter have not started warlock not enough time day lol so grinding week stream along with games ,993883974379474944,,,,None
ur will sg buloh ,993883966896619520,,,,None
actually excited dlc today forgot feeling ,993883960282435587,,,,None
forget impress wanna do best which means taking shorty some time  but all will fall place literally have relax destiny ever felt like know much feel much also outfit spring mood pa ,993883953508569088,,,,None
enter 2 ps4 pro giveaway ,993883932885217280,,,,None
2 dlc soon want exotic sword  ,993883923028594689,,,,None
mean rant about today work future both will lead different only thing brings motivation nowadays try not waste energy ranting used result days are more productive before ,993883902526869505,,,,None
discover secrets past polar ice caps mars 2 expansion ii warmind available now ,993883860021796865,,,,None
miss 1 so much so many good memories with game ,993883831093547008,,,,None
destiny_ cassper nyovest ft goapele cass album mk_kaybee ,993883830896484354,,,,None
dread it run it still arrives   ,993883828388118529,,,,None
know how have different like arch types weapons isnt like real life with religions ,993883815239184384,,,,None
well 90 people have left looks like run solo uh hey folks fix stuff cleaned friends list players ,993883814773579777,,,,None
menu music has changed 2 ,993883791147094016,,,,None
whats happing with two ,993883758041411584,,,,None
day ,993883756720144385,,,,None
dread it run it still arrives ,993883745689186305,,,,None
ohhhhh came chat bitch about 2 ,993883738735108096,,,,None
many choose wrong way ,993883734498738176,,,,None
sleeper black spindle suros regime all coming 2 ,993883728748347392,,,,None
tenacious have releasing sequel 2006 cult classic the pick destiny could coming very ,993883725426577409,,,,None
enter 2 ps4 pro giveaway ,993883719135047682,,,,None
problem after sheer number fuckups mistakes were made around 2s cynical release makes so much harder believe had idea were working on would release poor state sneak ie halved xp ,993883667129884672,,,,None
do universe fights souls together some things are too strange coincidences together physical attractions are common but real mental connection rare find it hold it ,993883641741762561,,,,None
2 soundtrack epic cant wait get play ,993883633579507713,,,,None
do not know child freak work ,993883629175504896,,,,None
voices are hearing are real god speaking you nation france you don armor take up arms lead french army destiny joan flames come let lick bones laugh ,993883592295043072,,,,None
try avoid destiny again dodges one similar will occur acknowledgment this law must prepotect victim ,993883587266179072,,,,None
check broadcast playstation 4 2 live ,993883582308474880,,,,None
are going live with fortnite dread it run it arrives all same now here should say am    ,993883556291207173,,,,None
myoui mina destiny  j ,993883530592579584,,,,None
anyone wanna commission so get dlc ,993883530353627136,,,,None
discover secrets past polar ice caps mars 2 expansion ii warmind available pc ,993883509306613761,,,,None
waiting 2 maintence end so guess good time some exercise ,993883501857394689,,,,None
lmao people still playing 2018 ,993883471478173698,,,,None
 make found you  be ,993883459452993538,KR,city,Jongno-gu,{'type': 'Point', 'coordinates': [126.97783, 37.56826]}
hook song sounds like rick ross me ,993883455267266561,,,,None
everything within reach pray god will open eyes opportunities people hes put life help you ,993883452658343937,,,,None
check broadcast playstation 4 2 live ,993883432928382976,,,,None
culutre non compliance man manifest mfs kill with  ,993883431091220482,,,,None
qasa starbucks dread it run it still arrives ,993883410513805312,US,city,San Francisco,None
narrates story lost ,993883363088875520,,,,None
glistening hd breasts king sweeter poon ,993883358349479937,,,,None
2 today hopefully update brings back d1 gameplay ,993883358319923200,US,city,Fontana,None
today speak exempted poverty command all efforts yield uncommon harvest point not bowed disgrace ,993883342318850049,,,,None
cause are destiny ,993883322932604930,,,,None
live stream starting now pubg 2 expansion 1700 bst  0900 pst  1200 est ,993883316288917504,,,,None
only outfit like zen doing chainmail remind multiple crusades genocidal cullings guise manifest are major part most major religions ,993883308642758657,US,city,Malden,None
believe do so more mere ego cant feel it dont know you ,993883302649106438,,,,None
maybe was destiny mine always leave everything with god ra ,993883296860917761,,,,None
tenacious back ,993883291873882113,,,,None
playing william engdahl manifest truth jihad ,993883276254371840,,,,None
got little light tattoo done 2 weeks ago now ,993883237641486336,,,,None
2 was let down osiris dlc was failure cant wait see how fuck up warmind  ,993883236844625923,,,,None
check enter chance win 25 amazon digital copy scions destiny ,993883232667095045,,,,None
must have control authorship destiny pen writes life story must held hand ,993883231375233025,,,,None
rasputin has awoken team with legendary guardian ana bray fight across unfamiliar martian landscape 2s latest expansion warmind launches today ,993883223997517826,,,,None
mix song  record guitars bass another track  make sure 2 updated all ps4s pcs ,993883209963393024,,,,None
women cale anal asian cute teen retro latina porn barbarian sex movies pornstar devon video little ,993883197460140032,,,,None
fucking moment warmind music do got 2 players tl ,993883187121025024,,,,None
waiting 2 dlc so hyped ,993883183572713472,,,,None
first day while had the get go home play been too long ,993883178824855552,,,,None
jimin blessing miserable life with extremely stunning wonderful beauty sexuality shit are angel devil time body god he created you youre ,993883172755722247,,,,None
been stuck traffic almost 2 hours point little far destiny ,993883162198523905,,,,None
has arrived play mad titan with thanos mode limitedtime mashup ,993883156548870144,,,,None
live starting with some more god war finishing with some 2 warmind ,993883144607752192,,,,None
shut up ,993883082737487872,,,,None
hype real guardians whos else coming back this      ,993883079134666752,,,,None
hype real guardians whos else coming back this      ,993883067436752896,,,,None
god bless era already being bias wrecked seokjin thing has leading to bts love 轉 tear concept photo amp version ,993883031093080064,,,,None
dont have time excuses ,993883029188771840,,,,None
well warmind dlc downloaded 6pm decide 2 still hot trash not cant make worse surely ,993882986205667330,,,,None
no destinys are written already ra would change destiny would trust eternity ,993882980069322754,,,,None
get home either megadimension overwatch competitive look see want buy 2 expansion ,993882978001604608,,,,None
provident northern thanisandra main road beautiful lake ,993882963489230848,,,,None
tenacious pick sequel coming fall ,993882949476061184,,,,None
all sitting d2 directory are playing d1 even games arent related all might bit thirsty end rant note everyone hope love have opinion content ,993882848095424515,,,,None
later friends ,993882844433960960,,,,None
could see bouncing back with sept update ive heard about bo4 so far leads believe cod dead forever leaving door open revival ,993882823168790533,,,,None
reminder will probably get 2 trailer in 1 month ,993882788901408768,,,,None
wildest stuff ,993882757079191556,,,,None
excited try warmind after work tonight tomorrow during day off but dreading all contacting server popups know going get ,993882710950195200,,,,None
going give 2 another shot miss 1 so much even though deleted all d2 characters kinda want give shot again servers come back up is ,993882691589300224,,,,None
yikes drama lol seen kid stacks playing with true vanguard man he sure got exposure hes scam ,993882682659688449,,,,None
current expansion warmind cant justify renewing ps rn no matter how bad want soooooo tips ,993882682206584832,,,,None
looking forward trying 2 expansion tonight especially some crucible maps congrats everyone shipping ,993882667094564864,,,,None
woop tuesday  plan today 2 servers come back up come check nioh the ,993882651797811200,,,,None
iron banner replays some 2 warmind hype ,993882646814998529,,,,None
might make break 2 im praying ,993882643983880192,,,,None
playing 2 ,993882629878493185,,,,None
day paul horton 645 ,993882615693348864,,,,None
fallen ,993882608386957312,,,,None
turn around ,993882595724115970,,,,None
because pubg doesnt have much content things monitor has lot things go wrong watched ,993882585427271687,,,,None
yup click 2 chose check download find start downloading it too lazy find timer store  ,993882527961141248,,,,None
content dryer arab sandal ,993882518142308353,,,,None
more 2 few hours stream gonna continue character finish up nessus io hopefully starting curse osiris end stream ready tackle warmind tomorrow ,993882510303088642,,,,None
words carry strength convictions today wh more capricorn ,993882505177526274,,,,None
majority people dr strange heard before movie majority players playing warmind wont know was were multiple warminds deep lore change so mainstream consume fine with ,993882484692537344,,,,None
2 how prismatic matrix works eververse rewards ,993882467068067841,GR,city,Corfu,{'type': 'Point', 'coordinates': [19.91540194, 39.61944304]}
also should stop taking advice people refer giving birth what body was made for ,993882449917640706,,,,None
been down before been hurt before got up before good go good go it got get up get ,993882437062098944,,,,None
very surprised dev finally this havent touched game months not 12 weeks after coo looking back playing again few hours hope warmind isnt big disappointment massive fan hope d2 becomes good d3 too ,993882410709340160,,,,None
in time will know like lose feel so desperately right yet fail all same dread it run it still arrives  thanos ,993882407295070211,,,,None
whos playing 2 ps4 tonight kinda wanna hop party play through with someone like days ,993882405441294336,,,,None
destinywell decide destiny ,993882381864980480,,,,None
servers down until 2i miss kslims live ,993882367000489984,,,,None
drawwwww  ,993882363678474240,,,,None
last time checked controlled so do math ,993882359509471232,,,,None
thanos fortnite now 2 dlc in ,993882320062111744,,,,None
got 3 more super special videos week top 10 thursday about best games ever played talking about 2 tomorrow friday are digging into some dark souls  ,993882311165956096,,,,None
2 warmind unleashes frozen hive mars today ,993882282359443461,,,,None
back much earlier expected so definitely live warmind launch missed feeling being genuinely excited dlc launch ,993882208795586565,,,,None
or maybe lost forever lifetime ,993882197802274817,,,,None
warmind with fireteam come check 2 dlc affiliate amp ,993882171021627392,,,,None
7 returning destiny exotics 2 warmind ranked ,993882169259966464,,,,None
xd remember that ahhhh good times well hope good times come back soon miss playing all time ,993882159919218690,,,,None
finally getting conference finals feels little like destiny take tbl ,993882143553150976,,,,None
while do have major influence destiny boiler drops through roof kills you spouse friend greatest irony company were starting jobs faultless simply  happens ,993882139962826752,,,,None
enter 2 ps4 pro giveaway ,993882137156866049,,,,None
warmind 2 dlc stream going down installed ,993882129825136640,,,,None
streaming 2 warmind dlc 7pm gmt enjoy music meantime live ,993882070022807553,,,,None
guys bungie trying hard improve game more more universe far favorite video game universe so excited story changes update im impatiently waiting  ,993882047520260096,,,,None
it moments decision shaped  ,993882046324932608,,,,None
going fast makes feel alive heart beats hyper drive do win only lose let choose ,993882039907581952,,,,None
one love heart destiny  bob marley ,993882031217102848,,,,None
still arrives ,993882027215777792,,,,None
excited play today after not playing few months hope see guardians around ,993882016063131648,,,,None
last night actually stayed up until almost 3am playing iron banner was so fun hadnt done first few weeks 2 know work takes time reassuring see changes coming in so much better reading too  ,993882000405692419,,,,None
so much destiny safe working stories  ,993881950397124612,US,city,Middleburg-Clay Hill,None
lot people couldve been better start but every game has things development needed fix patch d2 is game still fixing hell d1 was still getting fixed y3  ,993881861792391168,,,,None
hometown developers expanding experience lt3 ,993881827281694723,,,,None
a family shattered book two michals series ,993881785846173697,,,,None
2 ,993881780125093888,,,,None
im wearing shirts anticipation wearing shirt band while show faux pas super excited fan ,993881747082416129,,,,None
are ps4 go 2 logo hit options button check updates preordered mine already downloaded ,993881737120841729,,,,None
dread it run it still arrives thanos  credits   keep clicking keep sharing    ,993881690199080960,,,,None
really  2 killed game imo whats different  ,993881673086459904,,,,None
happy warmind day everyone going live with dlc tonight 7 cst giving away copy 2 come hang out ,993881666337861632,US,admin,Arkansas,None
 good  dlc good miss so much ,993881637518741504,,,,None
someone explains raid mechanics ,993881622247366656,,,,None
called months ago you even singularity theres shot ts foot brain went jana ,993881620351541248,,,,None
warmind menu music ,993881600575193088,,,,None
im excited 2 expansion but im not sure did everything last expansion tbh  ,993881525551816704,,,,None
still arrives thanos ,993881523626696707,,,,None
happy see some people being excited hope dlc does well really want play some good destiny ,993881521953091584,,,,None
heyyyyyyyup friends warmind dlc day are excited have jumped off train ,993881494035812352,,,,None
again bc did took away some dumb reason two ,993881479078957061,,,,None
looks destiny yeah pretty accurate shame corporate ruined potential ,993881462708486145,,,,None
 was not so girlish   more like mature makes feel like should try another concept mature  do should stick concept ,993881454856712194,,,,None
cant wait play again lets do this ,993881413668802562,,,,None
soul left body thought its destiny finally get meet him ,993881396220514307,US,admin,Florida,None
gonna sequel tenacious pick honestly dad so more amazing news ,993881316679708672,,,,None
inspired ice cubes kill will meant dothis purpose destiny ,993881300212822018,,,,None
how games like do instant updates 2 still have downtime 2018 ,993881266360635392,,,,None
big day streaming today starting off with league fortnite dlc come keep tilting ,993881263365910528,,,,None
finally because record stuck beirut cafe trope first time met was beirut cafe every saturday morning would meet with beirut cafe honestly were lot more fun then embrace tony 3 ,993881176967348224,,,,None
live footage community now ,993881156138520576,,,,None
blessings act umbrella against all oddsit will not change destiny but will act shield help most respect elders serve parents ,993881154242543618,,,,None
still arrives ,993881150362980352,,,,None
terrorize share it so have good kd  are competitive players ,993881139352948736,,,,None
cheif executive mr oliver plunkett good luck will found mh370 250sqkm search area destinys 3rd eye beyond mind science provided location bay bengal territory ,993881092280274944,,,,None
every democrat world will agree nation entitled strike independence wish dream hope nobody world has stop  nation must rise ashes a  march nation ,993881087519744000,,,,None
2  expansion 2 warmind launch trailer ,993881083841253377,,,,None
2  expansion 2 warmind launch trailer ,993881078707507200,,,,None
congratulations destiny so proud you ,993881075310088194,US,city,Virginia Point,None
are caught up intrigue creative romantic possibi more virgo ,993881049963741184,,,,None
2 servers down warmind dlc release date unlock time approach ,993881015834771456,,,,None
only could harness energy output created players mashing buttons see servers are live ,993880930359169024,,,,None
gone head nah like told ,993880912969588739,,,,None
wish could duplicate myself have myself friend ,993880880216199168,,,,None
should give 2 another try lmao ,993880875191422976,,,,None
power believe self becomes power changes destiny genma shiranui ,993880864407764995,,,,None
well first all changes major bungie examples star wars didnt jedi dont exist took cannon archived make room stories bungies doing thing people get star wars changes get ,993880855083823104,,,,None
support  someone tweeted this dont downgrade dream match reality upgrade faith match destiny  ,993880757025288192,,,,None
2  playstation 4 collectors editionconsole not included  ,993880715627548672,,,,None
well game ended but destinys child saga has not ,993880711697350657,,,,None
its 1149 not able play destiny ,993880710531317760,,,,None
2 warmind dlc release date unlock time plus preloading shared google feed ,993880709570940929,,,,None
joy im so happypick was delight watch ,993880703208165377,,,,None
 but before like has been before came before me take up mantle shield defend protecting daughter peggy carter steve rogers  ,993880671608172545,,,,None
content too see yall week ,993880670962311168,,,,None
so doing things with today ,993880648736649217,,,,None
anyway im taking friendship applications lol more friends like setting up babys room shooting ball its sunny like today listening music ,993880557321904129,,,,None
been playing with friends couple weeks loving it getting full band back together check clip aj_the_gr8 streaming 2 ,993880550011105280,,,,None
so context were 3 girls yms team mc jokingly named michelle kelly beyonce destinys child before game started because he couldnt remember real names ,993880532860596225,,,,None
download mb58 album  ,993880445250138118,,,,None
2 down another two hours aaaaagh ,993880401360965633,,,,None
late mayearly june like standard vacation time already ready wag destiny ,993880380880179200,,,,None
brought yourself still arrives ,993880370931224576,,,,None
dont care anyone says im excited expansion dont ranked will justify problems core pvp but pve looks promising ,993880366254608384,,,,None
so started thing someone meets asks real destiny have give dollar yes does really work ,993880345186533378,,,,None
