god indeed changer ,993895659022553090,,,,None
thanos collaboration came with 2s dlc lol so much options  ,993895653708251136,,,,None
good night everybody ever are dont forget dont written stone lying always hands everyday ,993895641364430848,,,,None
titan ftw obvs ,993895588763783170,,,,None
calling all 2 pc players are you team up do missions dlc content week ,993895554231889920,,,,None
dread it run it still arrives ,993895519591256065,,,,None
2 pc clan discord ever people run with ,993895497265025024,,,,None
could see it maybe part destiny lol ,993895425395580929,,,,None
are not good no insulting that obviously dont have values cos ideal people doesnt hate envy people progress do her her cant change that ,993895405833326592,,,,None
choose ancestry choose history choose class write destiny basing lords magic ,993895395657994240,,,,None
everything know about 2s warmind dlc pack  view  ,993895390012420096,,,,None
so anyone was thinking about getting 2 only 12 humblebundle ,993895375957299201,,,,None
been lucky enough around 6 different dlc dropsgame releases related destiny gets old day release best feelings really excited looking forward trying all content ,993895374585769984,,,,None
servers down warmind dlc release date unlock time approach ,993895337470365696,,,,None
set tone leadership convincing people t more gemini ,993895288610869248,,,,None
check broadcast playstation 4 2 live ,993895281996509184,,,,None
white ppl drinking off ihop glasses  ,993895280503377923,,,,None
destinymy rightto look dashing 18th c mens ensemble preferably acting alongside keira period drama secret lovers look better kneebreeches all men ,993895275721908226,,,,None
best friend sister forgot give  always ,993895223628632069,GB,city,Manchester,{'type': 'Point', 'coordinates': [-2.24328418, 53.47697785]}
going live 2pm est with expansion ii warmind ,993895220600160256,,,,None
feels great asf  ,993895158696628224,US,city,La Porte,None
someone tries eat last nuggie ,993895110755614720,,,,None
no change so feel free okkkk ,993895109350567936,,,,None
english meaning english baby name english meaning is certain fortune fate mythological greek god fate ,993895089112997888,,,,None
30 dont crossfit gym with sister failed life  ,993895088299405312,US,city,La Porte,None
1hr amp 30 minutes streaming warmind dlc 2 dont know about you but ready kick some ass ,993895073149530112,,,,None
so miss durban ,993895044817080322,,,,None
6v6 last weekend was awesome first time played 2 long time bummed 6v6 gone already hope see back soon ,993895031353237504,,,,None
chadwick looks like he hardest character planet ,993895029033889797,,,,None
2sday ,993895027423068160,,,,None
how will eat away destiny ,993895012034367489,,,,None
titan first character ever made always first frontline but warlock hunter follow ,993895011467935744,,,,None
streaming little bit rimworld before 2 dlc goes live later today wont streaming that sorry ,993894978106601481,,,,None
arive damn yall talk like ,993894957822996481,,,,None
change ,993894956166254592,,,,None
going try today ,993894948251602946,,,,None
gonna make homework activate gears will update start ,993894929683402753,,,,None
thoughts this ,993894852839567362,US,city,Belle Haven,None
bungie has much harder tool work with common knowledge destinys game engine hood complete crap takes far longer complete changes engines do with fraction time risk ,993894831322816512,,,,None
no matter are will find you mim ,993894829888299009,,,,None
biggest asset recognise are ,993894819230638080,,,,None
hour fifteen till 2 season three  warmind dlc live im hyped ,993894815338237953,,,,None
wanted play 2 before going work but guess have wait until servers calm down lol ,993894799051706368,,,,None
check broadcast playstation 4 2 live ,993894758866042880,,,,None
god private matches destiny finally destroy friend 1v1 so hyped ,993894755208777728,,,,None
the only everyone shares death  neji naruto ,993894746631299072,,,,None
guys so updating warmind 2 had close reopened continue download stuck initializing ,993894718718214146,,,,None
prob go back work make sure september release 3 arent unmitigated disasters said ill logging hunter get off work ,993894716272979969,,,,None
well has been written all ready wrote living lifes ra lifes are writing destiny ra put scroll ra ,993894691472072704,,,,None
drop nuclear bomb  177km are destroyed drop bts concept pics  whole world destroyed forget about atom bombs thats call dangerous  ,993894689605668864,,,,None
played remake crash trilogy loved it hyped see work expansion destiny  ,993894689215598597,,,,None
cheers dude super excited see different creative team does with destiny ,993894676389232640,,,,None
working some seedstuff today still secret though ,993894652339044354,,,,None
ill playing 2 dude fortnite aint fun ,993894650443419648,,,,None
booted up 2 know servers are offline but had listen intro music ,993894630134632448,,,,None
yo doing 2 dlc giving 1000 v bucks 30th follower  live ,993894625625694209,,,,None
son killing me saiyas ,993894550337937410,,,,None
live with warmind story play through with amp come watch todays topic  favorite dlc date come hang out ,993894527504089093,,,,None
fighty destinycanoeend bark goes doggie gary so winner divine lawsuit rights title ea ,993894517240512512,,,,None
love dee ,993894504439648256,,,,None
thats kinda reaching because was case women do thing so its no good women anymore ,993894501436526592,,,,None
game has positive review percentage 8546 negative review percentage 1454 932 tweets analyzed ,993894464446959616,,,,None
daughter was kept with lies fake dna test was born 2005 again year 2018 after govt found great grandfather was lucky luciano dna test didnt know until year ,993894459497578496,,,,None
im listening destinys child  ,993894423992963072,,,,None
8 yrs really finna go quick asf ,993894415491051520,US,city,La Porte,None
its destiny ,993894392434974725,,,,None
check broadcast playstation 4 2 live ,993894374563045377,,,,None
all hype ahhhhhhhhhhhhhhhhhhhhhhhhhhhhhhhhh ,993894341960720384,,,,None
time reinstall fuckin guess ,993894329948233728,,,,None
destiny john william case ,993894296578416645,,,,None
like bungie really gone all dlc music man chills excitement bringing feels again golden days 1 ,993894284565807104,,,,None
in time will know like lose feel so desperately right yet fail all same dread it run it still arrives ,993894283106136064,,,,None
damn people really hate 2 bad imma still dip toes bought expansion pack report back findings yall ,993894273891237893,,,,None
eng fifa tots 2 update  ps4 ,993894254115160064,,,,None
so happy amp proud taking control her career amp destiny brave young lady made excellent choice ,993894221890359296,,,,None
happy understand some things are really important but know more important future try about generation try about fate dont blindly accept things because now ,993894189074010112,,,,None
lol someones hurt now damn not only did hurt feelings but did well daaaaaaamn bruh  ,993894182145089537,,,,None
live have fun with 2 dlc ,993894150041894912,,,,None
see dilemma have some fun play 2 released ,993894117267603456,,,,None
avengers 4 cosmic threat would arise cap iron man would wield forcecosmic cube rewrite universe but die end ,993894106739937290,,,,None
about time  ,993894106429644801,,,,None
1 who 2 were still control destiny 3 who 4 its 2018 not 2016 but would loss obviously come mate know youre pissed off but try keep hold towel until sunday ,993894084715732992,,,,None
nothing compare love passion brooke amp bill had together are each others destiny ,993894049118674946,,,,None
based nigerian gospel song didnt explode west which surprising cause got main child group together ,993894048191664128,,,,None
check broadcast playstation 4 2 live ,993894039283003392,,,,None
iranian are patient people while 8 year all world support iraq stand beliefs victory after 20 year enemy destroy another truth ,993894024120430592,,,,None
really excited stream again miss want see play 2 excited game again ,993893987973971968,,,,None
lol actually hate times do well not ive even touched game previous dlc but like said warn us warn days advance im sure have more games play destinyat least hope do  ,993893952360071168,,,,None
got pc version hit run gonna learn controls off stream do some learn speedrun level level stream after marathon ,993893949822586880,,,,None
searching about found amp was not fault the best years life are which decide problems are own do not blame mother ecology president realize control destiny ,993893933762531329,,,,None
dreams are like stars may touch but follow will lead  ,993893827856433152,,,,None
destinys child does perform otr2 done all through ,993893825071460353,,,,None
fully understand start learn how change ,993893812631027712,,,,None
yeah hell yeah stayed home called in got time im master destiny slightlyliquified exhausted recovering master destiny but still nonetheless ,993893760827244546,,,,None
warmind releases 7pm start work 930pm its first release kind havent booked off work sad about ,993893745090285569,,,,None
pastor may higher church putting fellas work today ,993893739465789441,,,,None
ridge substitute until goes back her real true bill ,993893727876927488,,,,None
bought 2 humble store  ,993893723577749504,,,,None
most friends are murderers dreams dont force friends into meant you burning inside you alone ,993893700072767492,,,,None
erie destiny ,993893646096355328,,,,None
kenny was get social security numbers released internet wendy uh kenny but wasnt really supposed intense ,993893645857185792,,,,None
with you lore absolutely fav things about destiny especially siva ,993893600361615360,,,,None
destiny  will give hand ,993893551841853440,,,,None
2 pretty much dead meme like ugandan knuckles put all effort 3 because game straight up garbage 2 dont exist 1 was so much better ,993893549958672385,,,,None
ari  ,993893549119885315,,,,None
have been happy warmind day private mentor chats excited ready play congrats amp expansion into universe  ,993893539426816000,,,,None
was joke djkjfknmh love onewild ,993893538957012992,,,,None
im gonna rot13 takes yall so dont worryyour safe loud mouth ,993893524176158720,,,,None
check broadcast playstation 4 2 live ,993893496485445633,,,,None
probably best music has come with ,993893489665392640,,,,None
lets see get tan 5 weeks im ghost so wish luck ,993893454932406273,,,,None
but manifest like general american nationalism whereas slavery was domestically controversial start ,993893416542105601,,,,None
lets hope all turn up amp play could playing final spot come boys get 4th rest before final amp greatness awaits all were all with manwomenchild do 967 ,993893408459587586,,,,None
entered star wars twoplayer game ,993893403782885376,,,,None
all had do was be petty  ask and ,993893395620823040,US,city,Memphis,{'type': 'Point', 'coordinates': [-89.98343468, 35.23070465]}
how so confident was beneficial deal world people deal was good financial deal european save big financial crash europe pay attn greecespainitaly brexit  ,993893371126018048,,,,None
2 soundtrack fire ,993893367347105793,,,,None
one meets road he takes avoid it oogway ,993893319263637504,,,,None
agreed destiny ,993893314775715841,,,,None
admit enjoyed 2 first came out but content simplicity everything drove away will always have special place heart but unless see change makes game worthwhile return to flame has simmered ,993893312959479810,,,,None
2 later today7pm est determining game play ,993893304579194880,,,,None
serendipity destiny soul mates ,993893289005793280,,,,None
cannot wait get home do destiny ,993893283821641730,,,,None
two dlc got more pumped preshow ,993893279585333248,,,,None
check broadcast playstation 4 2 live ,993893228955910144,,,,None
gave up halfway through first dlc  ,993893228138115072,US,city,Brookside,None
cant layout bc get hot af 10 minutes ,993893211792920578,,,,None
todays day get excited about future 2 exciting things coming ,993893205711048704,,,,None
check broadcast playstation 4 2 live ,993893203471486976,,,,None
only act move heart now no destroy because creator amp dictator life journey destiny ,993893193157627904,,,,None
know all this must instruments stop million excuses each individual responsible himself family community cannot move even family let alone community until deal with individuals ,993893156377722880,,,,None
source provided destinys 3rd eye science final resting location map submarine ,993893141420879873,,,,None
results  easy 136632 pts  record 3066pts ,993893108642443265,,,,None
alright so 2 servers are unavailable refusing connect so gonna start farm stardew going live nao ,993893093329039367,,,,None
tenacious are making sequel the pick destiny ,993893057232818181,,,,None
guess heading back huh ,993893028702994432,,,,None
been dying tubers open packages today feels like day do so question what will 600 gunsmith materials get me ,993893021606432769,,,,None
our true world built bottom up competent citizens living solid communities engaged places  david w orr battling epidemic loneliness ,993893017722413056,,,,None
ds mom texted last night made asked looked like her its so cute  ,993892943525220352,,,,None
itz boiz dedassprime jerebeer bringing another live stream todays stream will playing 2 doing hoodrat shit mars instead playing thanos mayweather fortboiz edition start 1030pst ,993892900751654912,,,,None
sounds like good idea online only game expansion unlock instead download cant access content have problem but tested first ps ,993892873379745793,,,,None
still arrives ,993892847098228736,,,,None
separate twist until arrives frames face better ,993892844472586245,,,,None
ive always loved dlc release days ,993892839393251329,,,,None
intentionally choosing form courage amp ones life destiny ,993892829217935361,,,,None
shows until someone all people try live life know nothing about so really no good men anymore ,993892796623937538,,,,None
also definitely do not do that know kill fashion game no matter p but xg amazingregardless ,993892795105644544,,,,None
starts up 2 epic music starts playing 2 servers are not available ,993892794824577031,,,,None
its purple its called catalyst its got handy revision guide back its beer its  thats not diisopropamine partner it ,993892762260041728,,,,None
ur not type guy walk with herd get by ur strong enough stick ur principles not sell ur soul devil respects dear so glad see ppl standing up believe not losing sight destiny best wishes ,993892742655758336,US,admin,California,None
im going bring game back shop bought change 2 cod aw ,993892728353312768,,,,None
ah dracula infamous one must uphold air mystery couldnt wanker simply friend was bloody vampires air mystic needed have wesley hoped he wasnt going have learn ,993892714688204802,,,,None
2 warmind dlc available download now enjoy music title screen while wait hotfix 1201 ,993892670865997824,,,,None
moment opened picture sunggyu daehyun sang 천사 같은 너 no joke call destiny no coincidence ,993892632840556544,,,,None
hello destiny internet concerns ns reach assistance you nw ,993892611332059137,,,,None
may 8 2018  2s expansion warmind comes today figured while wait thing to ,993892599877554176,,,,None
letting go means come realization some people are part history but not part destiny steve maraboli ,993892588569559040,,,,None
told was apocalypse disnt rescue hands persecution is should have believed me gave supernatural signs wonders even said lord most high how bad do want escape destiny freedom ,993892557108244485,,,,None
although are many questionable choices have been made comes 2 whether lore classes weapons power abilities etc still love game still live breathe franchise fair are definite times drop out ,993892475138818048,,,,None
injustice anywhere threat justice everywhere are caught inescapable network mutuality tied single garment destiny affects directly affects all indirectly mlk ,993892449088032769,,,,None
aw miss being love ,993892415722479618,,,,None
 not every teacher teacher truth va still teach manifest will god amp slaves were needed work plantationsspend more time civil war holocaust amp no mention eradication policy amp genocide native indigenous ,993892366049148928,,,,None
to blues future ,993892364493049856,,,,None
after get response do character didput boots cowboy hat find good horse shooter figuratively course no guns needed earn doctorate degree make destiny ,993892352304574464,,,,None
titles avengers 4 are avengers final chapter avengers into multiverse avengers force avengers quantum quest ,993892317584076801,,,,None
maybe met was destiny dearest believe unbs today tomorrow its very reassuring have lets make many bright memories remembered together forever always thankful trust with future ,993892312848613377,,,,None
yahoo boys would run babes use destiny ,993892309375664129,,,,None
theres no turning back hearts attack gonna give everything have cause will will fight will fight til forever make knock down will not stay ground pick up pick up ,993892298160246785,,,,None
people dont determine destiny god does ,993892187174776832,,,,None
no content destiny its reskinned content will grind non less ,993892180447170560,,,,None
preloading update 2 now see changes dlc sprinkle even small amount water dumpsterfire update goes live 2pm est so see then ,993892104890867713,,,,None
do know anyone plays 2 wouldnt mind hooking up with group finally try some raiding trials some point ,993892088491192320,,,,None
black veil brides  ,993892085639020546,,,,None
enter 2 ps4 pro giveaway ,993892083667820546,,,,None
servers still down taking nap ,993892074184470528,,,,None
cannot look approval only god give affirmation boldly hold truth pursue him ,993892071562993665,,,,None
so glad bungie put some music title screen least hopped into expansion dropped music hit man knew were going into some awesome was sad curse dropped didnt title music update ,993892070258593794,,,,None
only internet would allow open could join fun ,993892051963047936,,,,None
accidentally bought destinythe king instead 2 expansion pass chance get refund ,993892009780957184,,,,None
god wasnt guys mood  how write someone  ,993892006312271872,,,,None
dont forget history nor destiny ,993891991141445638,,,,None
steph promise yesterday take breath away was before heard video amazing both use random phrase day how does happen karma meant fate not meaning ,993891988738138113,,,,None
everyone want interrupt everyones excitement 2s dlc fortnite thanos things announce emotes are live ,993891983918854144,,,,None
how science will shape human daily lives year 2100 ,993891947596140545,,,,None
2 dlc worth playing last dlc kinda was big letdown better actually worth playing ,993891947126378496,,,,None
bill amp ted 3 pick sequel have been announced week ,993891945226256384,,,,None
too little too late let eververse money destroy franchise most are only coming back bc stupidly bought season pass make 3 awesome youre clearly capable ,993891929598447617,,,,None
uninstalled 2 two months after release felt urge pick up again dlc doesnt really tempt either dunno why loved first game death ,993891899604983809,,,,None
growth not destiny ,993891870668288001,,,,None
results  easy 133566 pts  record 274pts ,993891850447736832,,,,None
dr brian weiss follow heart do not afraid fear blocks understanding following destiny ,993891848308514816,,,,None
jump into 2 warmind watch google io decisions decisions ,993891842205896705,,,,None
being loner looks destiny ,993891821079089152,,,,None
so decided try dlc today come fix servers are shit again playing 2 ,993891807397367808,,,,None
someone with username dunno specific one been while anyone talkes about ,993891786815889412,,,,None
totally forgot 2 was thing until all ads promoting dlc ,993891718196948992,,,,None
king legendary edition multiimars xbox360 ,993891713444872192,,,,None
good stream today buds little hiccup middle but settled quickly kept going hard doing off schedule stream 2 dlc warmind about 4 hours keeping normal schedule 8 pm well hope see all there ,993891690132975616,,,,None
dread it run it still arrives ,993891685959692289,,,,None
me midyear bonus oohlalaa  bills dread me run me still arrives  ,993891681912078336,,,,None
destinys child isnt mood its life ,993891680955846659,,,,None
reminder iran 3xs size iraq didnt do well iraq but bolton still wants fulfill pnac trifecta war with iraq iran north korea ,993891676879032321,,,,None
stream will live 1 pm cst dlc goes live interested start game see how different 2 will be gonna costreaming up with so come watch ,993891631752458240,,,,None
im surprised book but misinterpreted very ambiguous about biology destiny ,993891627621142529,,,,None
want stream dlc 2 tonight but dont pc handle game streaming time ,993891612974567427,,,,None
throwbacks make feel like certain shit really destiny ,993891566728220673,,,,None
being personal  ,993891535509958662,,,,None
entered cbn abuja first time today guys supposed working lies  ,993891521953968128,,,,None
bro idk whyyyy tf has phone answers ,993891517361197056,,,,None
totally didnt wake up early go work early so could leave early play 2 not all ,993891512004984832,,,,None
moment get home take nap before 2 dlc drop scrolling through twitter find avengers ltm fortnite agony decisions ,993891505998909440,,,,None
he listens music  emotionalsentimentalnostalgic both comics movies origin story was always about being split between grand superhero call action being heavily flawed emotional dude occasionally does dumb shit ,993891455486771200,,,,None
too late manifest which was pure power grab but relevant high imperialism aryan race theory ,993891408221270016,,,,None
has best bantz sure ,993891391888658432,,,,None
calling mallard see he wants come some madness ,993891369017118722,,,,None
meh current state 2 not worth 12 bucks but humble bundles are always full hidden gems ,993891348238479360,,,,None
destiny will remain eternal ,993891332576788480,,,,None
finally 2sday ,993891302721830912,,,,None
yaaaay community spokesperson has appeared soooo glad tune with hearts minds every 2 player how else would able get feelings articulated twitterverse wisdom insight hardly wait tweet ,993891297726484480,,,,None
so decided reinstall 2 try dlc shit will not play game ever again ,993891287127511040,,,,None
2 version 118 already downloading will done before returnnice ,993891215912321024,,,,None
know plug got  ,993891176892821505,,,,None
no 5 control her no 8 control omg fam thanos ,993891163345113088,,,,None
mean yall know monhun was first fuckin love so naturally had get dropped bit but with season three finna start bitch gon have back burner bit ,993891128423350273,,,,None
after everything evil team did malign ceec house still want her fail reality newsflash cant control her destiny will keep winning will deal with it evil people ,993891116318633984,,,,None
2 about dominate free time busy pubg schedule allows get love it fiber being installed home type this tuesday alive  ,993891108798304257,,,,None
side difficulty level destiny nothing random youll stay faith all things are going work good ,993891101772787712,,,,None
im some good men but some people choose different  ,993891087889653762,,,,None
ranked play released today time see how bad truly  ,993891060890984449,,,,None
so uh dont have plans later tonight was wondering maybe would wanna play some expansion with me unless playing with boys console go ahead ,993891052636356608,,,,None
2 servers down warmind dlc release date unlock time approach  gamespot ,993891040368132096,,,,None
with 2 warmind dropping today might good time check game humble has part humble monthly use link helps out ,993891000325148673,,,,None
mom didnt want talk last night so wrote her letter instead how im moving out ,993890991496196097,,,,None
did know found islands indian ocean shell gained popularity much ancient africa cowry symbolizes power african female symbol favorites ,993890963146801158,,,,None
open up airline call destiny because dread it run it still arrives ,993890953294503936,,,,None
may be no should be people doesnt has content ,993890945652404230,,,,None
always remember snakes dont changethey shed align with people fit not history  windhoek namibia ,993890921174454273,,,,None
keybring destinyは ,993890918326398977,,,,None
big pill finally created account  be like friend  cause too wavy wanna match fly  ,993890845144346625,,,,None
check broadcast playstation 4 2 live ,993890844989157383,,,,None
first pick sequel this happy day ,993890833115107328,,,,None
alright guys will going live shortly apparently was update 2 missed sorry ,993890832448180224,,,,None
enter 2 ps4 pro giveaway ,993890815406694406,,,,None
cant wait play stuff ,993890801380884483,,,,None
bruce swallowed hardly pulled sleeves up when mom died ii felt useless alfred helped too much but felt was hurt sso started cutting myself not only wrists also neck legs he looked down taking pause ,993890787908898816,,,,None
pulled all stops ,993890773555806208,,,,None
deal alert 2 currently available lowest price ever part monthly bundle ,993890772373024769,,,,None
have heard jay oskulata  flipzero 7 ,993890745860935683,,,,None
tough wait all 50 people still play 2  ,993890729884864512,,,,None
god want play 2 dlc jk lo ,993890603606990850,,,,None
bruh 2 extinction protocol looks baller af ,993890597491695617,,,,None
results  easy 133292 pts  ,993890592739479552,,,,None
dlc coming live come hang with me want run dlc ,993890583914561536,,,,None
must come destinys job act stupid day ,993890553547968513,,,,None
pick up pop 2  cayde6 golden gun only 1199 ,993890551358369792,,,,None
loving destiny ,993890498518515712,,,,None
simple stand with majority voted leave sm cu ecj take back control destiny not sure left wing fascism supports democracy though ,993890495838474240,,,,None
