have brain enough faith show people life 5 years into future unless change mind  faiththought plansself actualization manifest etc reality may turn lot better plansgods plans will  ,993890492680163328,US,city,Greeneville,None
happy warmind day looking forward exploring expansion continue hopeful everimproving 2 experience ,993890469598773248,,,,None
check broadcast playstation 4 2 live ,993890460572807169,,,,None
will see day ability cross save 2 between pc console play ps4 pc would great time saver playing between both platforms dont care about cross play cross save feature would nice ,993890435046178816,,,,None
rip 2 ,993890389701595137,,,,None
choose ,993890346651222016,,,,None
am ,993890333154054144,US,city,Ava,None
pick up pop 2  emperor calus only 1199 ,993890302225088512,,,,None
sitting waiting servers come back on ,993890290409857024,,,,None
expansion will play nothing else days ,993890281765392386,US,city,Green Bay,None
sure hope warmind dlc 2 turns good because not im trading game after beat ,993890281115258881,,,,None
hello guardians veteran destiny after long journey finally provide pvp montage bungie go vote bungie video big up ,993890279320178691,,,,None
irony also best friend even mody cannot fight against both advvp ,993890272705679360,IN,city,Mumbai,None
hate vibing with someone hella hard find shit was dream lmao   caught slipping ,993890259774648320,,,,None
no im arent good cornhole ,993890215545753600,,,,None
check broadcast playstation 4 destiny live ,993890196428148736,,,,None
lmao getting excited expansion 2018 ,993890190304231424,,,,None
kind wanting make but put her cuppys group but not sure would want romani witchcon artist ,993890180305178624,,,,None
male would kiss her lips wrap arms around her waist he began pull her much closer destinyyou mean world mei love so muchi cant even put words he between kisses ,993890172801568773,,,,None
wth still thing ,993890160642113536,,,,None
person meets road took avoid it ,993890098369519617,,,,None
gotta fight some nasty disease dread it run it still arrives ,993890072079618049,,,,None
letting go means come realization some people are part history but not part destiny steve maraboli ,993890024050470913,,,,None
summer games are between 2 wow fortnite  ,993889983978196992,,,,None
today 2 dlc drops gonna play already payed smh gonna stream about 15 mins come check out ,993889902583525377,,,,None
crew all coming back it ,993889868127223809,,,,None
ah right so tempted do miss crucible best shooters ,993889852218322945,,,,None
friday already so get some jcole tickets  ,993889849202630657,,,,None
helpers will not reject request today winds favour will rise all corners world locate you will dig find water will plant reap plenty god will open ,993889843133517825,,,,None
pick getting sequel bill amp ted finally getting film after all years ,993889834375827456,,,,None
im advocating brothers  ,993889825534173184,,,,None
but hype though ,993889820945670150,,,,None
bungie 11 servers will online 1223 pm logs into destiny servers offline me ,993889807683276800,,,,None
stream will he live 2 servers come back online ,993889776720908289,,,,None
yo ive got wanting debate show dm fam ,993889774208462848,,,,None
youre timesensitive pam ross ,993889768219037696,,,,None
another 2 player maybe guys should team up ,993889742923157504,,,,None
cant wait see cast voices expansion want know actors are behind so far check episode voice talent ,993889684081307648,,,,None
could trace line manifest noble savage back tabula rasa tenuous line but about tenuous das kapital gulags ,993889622076809216,,,,None
best realised world best exploration most satisfying combat father son beats incidents ring so truea wonderfull product passion  guys trumped all sony studios with ,993889617484099584,,,,None
2 warmind dlc release time price more ,993889603592470530,,,,None
considering hopping into 2 more stream its only game recent memory ive actually enjoyed playing without worrying about viewer counts waiting warmind dlc though till wallet gets breather ,993889580075110401,,,,None
hey pat are plague going play 2 dlc chance ,993889546260664321,,,,None
servers up see some friends ,993889516158177280,,,,None
will streaming hour so with release 2 warmind dlc today ,993889513859514369,,,,None
got time wrong launch so sitting with nothing do another 90 minutes ,993889501410922496,,,,None
really hoping good cuz really wanna love again ,993889464517890048,,,,None
are sleeping through storm was designed wake up ,993889443961589765,,,,None
yeah ive been off lot recently but yeah cool play pretty sure still have 2 wildlands well siege division pretty sure ,993889428874649600,,,,None
sami callihan has struck again wrestling toronto this ,993889410981793792,,,,None
cant cheat ,993889387833450497,,,,None
so going stream 2 dlc mean already paid with season pass so might well try enjoy right ,993889333592690688,,,,None
idk but really havent been feeling good today currently waiting see whats happening with anyways dlc im considering working video instead theres few ive been meaning upload not sure will keep guys updated ,993889274427822080,,,,None
brandon do not start ,993889269637885952,,,,None
want join league people buying n5k credit but village people have tied n100 credit ,993889267507187715,,,,None
really hope its step up last expansion im still disappointed 2 was 5 steps back 1 left off every aspect but im still hoping bungie gets together ,993889202692673536,,,,None
wow testweek ends 37 ,993889139803283457,,,,None
were made reflect gods glory fulfill destiny ,993889131796180993,,,,None
cant wait make return later  ,993889096102752256,,,,None
busy summer work working out podcast lots fortnite 2 ,993889022895448064,,,,None
all connected gifts circumstances purpose imperfections journey destiny moulding you embrace it ,993889012543868928,,,,None
get steamed about people digging starlord bc misunderstand him imho he isnt about powers cool tech but rejecting prophecyto forge identity slash repping common earth man alien universe slash mocking dark gritty scifi ,993888993312845829,,,,None
was calling  ,993888987109646341,,,,None
worth more 900 yorùbá man will understand better  ,993888985507336199,,,,None
check broadcast playstation 4 2 live ,993888961612472326,,,,None
are going ignore fact aaliyah hell mediocre compare beyoncé child was outselling her also ,993888916242620416,,,,None
pick 2 go ,993888905916174336,,,,None
wait 2s servers come back online so check warmind take look impressions recent months game reading season two report card ,993888852711440384,,,,None
anyone else ready 2 warmind stream know am drops there ,993888837888888832,,,,None
have believe destiny will succeed will meet lot rejection not always straight path will detours  so enjoy view ,993888808050475008,,,,None
fyi time dlc will available 9th not day servers are down took off work because 8th angry fan come on ,993888803000549376,,,,None
monuments removal disrespect rubbing salt into wounds people mourn loved producing due course political clashes consequent skirmishesconflicts wars multiethnic yugoslavias should not leading example though learn it ,993888743332417538,,,,None
saya jadi teringat ayat thanos tu dato seri  in time will know like lose feel so desperately right yet fail all same dread it run it still arrives ,993888733790269440,,,,None
really wish could go back could run multiple raids week with buds raid lairs aint going do me giving up completely now ,993888706300792834,,,,None
are no secret success result preparation hard work learning unexpected photo session with all time favorite great khali dalip singh ,993888704967081985,,,,None
pray 2 gets better 3rd installment more like d1  ,993888696809254912,,,,None
oh day 1 summary wisconsin added places been letting crash giving food providing with television will make snes look like 2 max settings ,993888691541233664,,,,None
hey guuuuuys its warmind day will streaming most day starting 1230 mt want band depth look 2 dlc come join twitch also its first affiliate stream wooo come get emotes ,993888678882590720,US,city,Colorado Springs,None
 imma destiny imma love  let share most precious photo all time pancake sunshine  ,993888665351766016,,,,None
2 12 june monthly bundle suit sir ,993888645231841280,,,,None
definitive enemy are iranian  ,993888599102734336,,,,None
wow destiny coming along ,993888567704281089,,,,None
left thats important me game d1 beta e3 announcement game always was so its got get better ill wait  ,993888552525148160,,,,None
destinys child   album version featuring kobe bryan ,993888551736668161,,,,None
biological entanglement not consideration women made up like manifest destiny ,993888536142069760,,,,None
check broadcast playstation 4 2 live ,993888532006670336,,,,None
didnt accept like most people do  ,993888530408484864,,,,None
dont run away  conan haibara ,993888513518022656,,,,None
did know ahead time  fishy s administration most corrupt history america hurry cant wait see trump handcuffs sooner later will destiny ,993888451702525952,,,,None
current team working 2 truly care not team made doesnt completely misunderstood people about original d1 took 3 years become perfect game shouldnt take 2 amount time ,993888426880569344,,,,None
2am half clan up waiting go thats way well done bungie its been road guys im sure but surely worth travelling ,993888392290058241,,,,None
plans week 2 god war maybe fortnite speed payback tonight jumping into d2 story help dude end jump into baby big plans coming future ,993888391187050496,,,,None
2 updateandnobody cares ,993888345267699714,,,,None
enter 2 ps4 pro giveaway ,993888331707568128,,,,None
toto convinced he was switched birth looks back life with regret resentment avenge destiny he devises some terrible violent plans dont miss toto hero festival frenchspeaking belgian cinema watch free here ,993888315777650690,,,,None
are gonna play 2 expansion comes today ,993888308475453445,,,,None
  know someday far away clouds not doubt changing place fate could take hold fall inlove hearts soul  ,993888305111429120,,,,None
mastering destiny five tips organic business growth ,993888274174349317,,,,None
bruhh imma honest love dramarama  story actually has lot plot  ,993888221615489026,,,,None
written sky above fall love ,993888219170304000,,,,None
okay no matter what will fight future destiny aih let started throw away others hiyaaaaah ,993888215458238464,,,,None
yall ive felt so good about myself until started therapy man talking about past issues current feelings opened eyes lot things determine worth are driver destiny are control happiness feel good ,993888211809206272,,,,None
star wars forces destiny reveals the force awakens deleted scene ,993888184156090371,,,,None
2 warmind unleashes frozen hive mars today ,993888113561886721,,,,None
land expropriation without expropriation happening foresee false ,993888108524564480,,,,None
update 2 been waiting shit monnntttthhsss ,993888106016313345,,,,None
erika are fucking rats ,993888088643522560,,,,None
absolutely hilarious time 2 decides do maintenance suppose spoilt wow though which afford do nighttime ,993888014182047746,,,,None
weve invented because cant stand fact everything happens accidental ,993888000760139777,,,,None
have faith fate tailormade you ,993887994179338241,,,,None
change financial family ,993887988697436163,,,,None
far it ideology preset path destiny directly contradicts freedom choice have humans sense meant the lord decides correlation how choose live life see bigger picture ,993887968803934208,,,,None
another cake tasting more shopping should home after that expansion todaydo all want play it ,993887962994757632,,,,None
check broadcast playstation 4 destiny live ,993887956728414213,,,,None
this ultimate showdown ultimate destiny ,993887871466594304,,,,None
didnt feel develop bench candidates because thought had traditional base  professionals base not mention generally speaking thought demographic was heading ,993887848196648960,,,,None
mood kuz know thats like 95 ppls ,993887799102377985,,,,None
karnatakas elections very interesting very historical present internet era it will decided congress destinys rahuls political future bjps power test ,993887761558978560,,,,None
damn been years played destiny remember buying 360 2014 but ran gold  2 tho how ,993887713848946688,,,,None
run into destiny markers always feel beforehand like have no reason feel certain about something but know about set up amazing every  time  look god ,993887677052346369,,,,None
pt2 law attraction let thoughts determine destiny ,993887674841808898,,,,None
her kendrick lamar miguel kanye west destinys child goldlink biggie alicia keys yg kehlani john legend musiq soulchild stevie wonder earth wind amp fire drake justin bieber nsync bruno mars daniel caesar boyz ii men ,993887627077074944,,,,None
find another destiny ,993887614833905666,,,,None
running few errands ill live with some 2 ,993887560412860417,,,,None
ur ma destiny ,993887521124761600,,,,None
check broadcast playstation 4 2 live ,993887472525414401,,,,None
so basically satay sandwich know satay usually served with lightly pickled cukes destiny ,993887387595001856,,,,None
2 so fucking shit literally has less content features 1 ,993887386915438597,,,,None
actually excited play expansion hope lasts ,993887386353401856,,,,None
know guys probably cant because have professional but anyone baddeadfailing perfect no but means world lot people so  ,993887344905375745,,,,None
well like know how does looks like  myoui mina ,993887337154207744,,,,None
stake ma not 900 ,993887306225471490,,,,None
really want grab dlc but still cant forgive d2 launch years fanatic fighting disappointment had ,993887299871047680,,,,None
protecting 900 naira will still finish day ,993887294263308297,,,,None
the only everyone shares death  neji naruto ,993887283861426182,,,,None
check broadcast playstation 4 2 live ,993887226801995781,,,,None
pls bro pls give code bro pls pls bro pls bro lt3 bro pls bro ,993887217415311360,,,,None
np couldnt leave time ,993887213338349568,,,,None
amazing stream tonight so much awesome host got hype coming tonight opened up sick knife see all again tomorrow 630pm warmind 2 ,993887199870386176,,,,None
47months before found mh370 location scenarios told followers mostly everydaymh370 resting has condition with minor damagesnot brokenone piece ampone placeeverything locked inside door source destinys 3rd eye science ,993887192454959105,,,,None
life was like had go get check because im not stressing off shit all money fame buy bitchlil pete ,993887100025163777,US,country,United States,None
more exam warmind time its very summer games are 2 overwatch so might well get started lol ,993887069771632650,,,,None
505pm road no today ,993887052302245888,,,,None
alright twitter time leave you go do adult stuff while wait 2 expansion download like read mark waid prequel webcomici mean study do laundry ,993887047692836864,,,,None
are live killing time till 2 dlc goes live ,993887036720472065,,,,None
he continues hold female close some tears would begin trail down face yes he was really worried about her more probably realized i hope so destinyi really do ,993886977454936064,,,,None
destiny michael jackson ,993886954935803904,IT,city,Fiumicino,None
know ill always faithful bungie great always im already sitting waiting warmind start ,993886932705857536,,,,None
make persons love ,993886895531855874,,,,None
live today 11am 430pm pst 2pm730pm est would always appreciate follow back  tune in ,993886881283637248,,,,None
make persons love ,993886866935083011,,,,None
aaarghh  notion lives have preset path toil vain trying alter reality ,993886854402461696,,,,None
looking do meantime still login 1 ah memories ,993886807019442176,,,,None
deej could answer quick question uk psn store 2 expansion pack discounted till midnight question will weeks days discounting deluxe edition psn uk  have standard disc but would love purchase deluxe edition thxs ,993886791668248578,,,,None
only got couple attempts rom but im learning fightmy mums home uhhhh 45mins ,993886757694386176,,,,None
 choices make chances take determine destiny ,993886754523332608,,,,None
lafmaoooooo surround with people definition not based history but destiny cee cs caption tells not proud life has lived wish her best her quest being better cee c ,993886729273856000,,,,None
dread it run it still arrives live de thanos jaja  ,993886712203014145,,,,None
picked up free graphics stream  ,993886701595582464,,,,None
interesting see current take 2 early unlock latest monthly humble bundle probably wont keep that but always slight curiosity about everything havent yet tried ,993886701570478081,,,,None
tbh pulis was always england so get martian swap with wouldnt even sad ,993886612248506369,,,,None
get ur pvc so continue vote pulls down until get want steer ship state into habour destiny ,993886611929780230,NG,city,Lagos,None
thing always gets excited expansion not guns not balance sandbox changes not maps story but music ,993886598738554880,,,,None
married more business pleasure happy with how are do not rush meant will everyone has take anything granted enjoy little things life brings most joy god bless ,993886589129404416,,,,None
bioshock 2 fans due stupid bodybrain not being able sleep properly like normal person had two nap instead streaming  going have early dinner ready 2 warmind launch two hours updating d2 now ,993886566866092032,,,,None
theres no escaping it tonight have win do control put bed timid capitulations weve seen against the rangers 2012 its never season hinges on lets get after whistle house  ,993886552198647809,US,city,New Orleans,None
every single day holy month ramadan shows big importance muslims lives but most important recommended all muslims 27th day month according quran 27th day also called night laylatulqadr arabic ,993886540513198080,,,,None
hope everyone knows im not helping answering questions doing fuck all apart stuff tonight amp few days ,993886538894315520,,,,None
check broadcast playstation 4 2 live ,993886476353064960,,,,None
im actually pretty excited check content today im sucker raid content keeps coming back ,993886476151738368,,,,None
must fulfill reaching goals no matter stage challenge is thats makes true determined champion amp character stronger good tuesday everyone 5818  ,993886456295907328,,,,None
l123li space destiny do we boldly go ,993886446397411328,,,,None
first expansion ever im truly skipping ,993886440047067136,,,,None
has weird doing her thing  ,993886430782021634,,,,None
forgot mention whole  ,993886405871984641,,,,None
guess ill redownload 2 check dlc hope its entertaining ,993886355175469057,,,,None
dont care how bad gets enjoy cause fun weapons cool enemies science silliness ,993886329309147138,,,,None
pochettino relieved spurs still hands ,993886311302905856,,,,None
god tho two more hours finally friends will praying again im really looking forward ,993886291749232640,,,,None
2 devs are promising change shooter genre with falls expansion ,993886256391045121,,,,None
bigging up hubs again  wanna see gameplay hes man ,993886253081944064,,,,None
world two young boys nothing blows smoke torn apart destiny saves desire ,993886219242299392,,,,None
excited warmind drop ,993886211214196736,,,,None
hey whether things are working 100 not guys make playing both 1 2 immeasurably better keep up awesome work lt3 ,993886207879843842,,,,None
answer honest question do want watch play through 2 dlc ,993886194781040640,,,,None
cannot escape destiny must face darth vader again ,993886190603587584,,,,None
devs are promising change shooter genre with falls expansion ,993886183158464513,,,,None
thats absolutely amazing congratulations ,993886158110183425,,,,None
with reputation guys have know will good day 2 starts climb back being great again patience going rewarded you again ,993886144688467971,,,,None
live with already waiting 2 warmind update drop will playing release ,993886096537866240,,,,None
another note today 2 expansion super hyped d2 took honors place temporarily until beat story ,993886077806137344,,,,None
attention fortnite fans get squad together because today arrives thanoss infinity gauntlet hidden arena first player find it becomes mad titans himself are still doing here get gaming ,993886076484882432,,,,None
ppl her mentions like this makes sensewhen aaliyah married divorced kelly died 2001 destinys child was already more famous successful her  jay aaliyah datedshe only dated dd bey jay officially dated 03but makes sense ,993886053022011397,,,,None
wut wut wuttttt playyinnnggg im almost done with morrowind took quick step away play through first 2 story im literally end it ,993886033556246529,,,,None
quick question have expansion pass does warmind dlc download separately has downloaded already season pass version 118 progress but not sure includes warmind dlc ,993886024161005568,,,,None
alright all have spoken will live warmind goes live hopefully play through entire campaign before have leave work looking forward hanging 2 ,993886018238537729,,,,None
2 soundtrack bringing life now so ready ,993886016019861505,,,,None
dont let down again love 1 had most memorable moments forget know guys will do awesome with upcoming updates looking foward it ,993885996210098176,,,,None
end nfc race only going get better lions control everyones  including ,993885986944937991,,,,None
ill streaming 2 hour two  ,993885977381748736,,,,None
get mentions with tier debate skills ,993885973271334912,,,,None
script destiny ,993885895140036608,IN,admin,Maharashtra,None
nick going tournament tonight nah expansion comes tonight so staying in youre worried about getting shit last tournament me ,993885836054675458,,,,None
ive died year more jesus did whole career see ya hell guys cus have lit heaven goooosh its damn hot  rock life guys  pls have mercy with poor soul ,993885823723597824,,,,None
whens up wanna shoot people ,993885806594084864,,,,None
so take arent friends today ,993885764286066694,US,admin,Missouri,None
announced he broforlife kyle gass would returning theaters with sequel tenacious ds 2006 stoner comedy pick destiny ,993885741456547841,,,,None
love feels like magic call destiny has sense humor call serendipity ,993885682530594816,,,,None
finally reviewed her little bit talk about line call me ,993885645495066624,,,,None
feels way bc truth you sir have godly discernment arent saved god army find saved go online christian trust amp accept jesus yr savior he will show yr destiny will glorious ,993885615597981696,,,,None
got some 2 action coming up today gonna jump back with warming launch see up with it starts about hour so food ,993885573176754176,US,admin,New York,None
dont forget history nor destiny ,993885571310383106,,,,None
talking leslie all time ,993885560514273283,,,,None
best friend brandonim gonna leave you ,993885556919549952,,,,None
2  expansion ii warmind pc released ,993885514754347010,,,,None
so wanna know how many have ps4 with 2 ,993885497398386694,,,,None
force was luke skywalkers destiny could start radio extravaganza 12 pm each weekday ,993885423779840001,,,,None
wait seriously loved pick destiny ,993885386320613382,,,,None
socialists dont like paying taxes like spending ppls money ,993885363050446848,,,,None
destinys child  bugaboo ,993885362685726720,,,,None
cant wait tonight 2 with boy jumping into warmind escalation protocol plan do nothing but chase exotic masterwork quests ,993885319958151168,,,,None
there group picked koreans like brothers have lot charms dashing good lot things gathered like destiny walking road amp want top 8line poem made woojin will forgotten ,993885298047176705,,,,None
pochettino relieved spurs still hands ,993885273099587589,,,,None
tenacious announce sequel pick destiny ,993885248772542464,,,,None
enter 2 ps4 pro giveaway ,993885246734176256,,,,None
funny asl ,993885240656527360,US,city,Rainbow City,None
playing bug boo fellow twitterinstagramfacebook buy song ,993885192875118592,,,,None
play dlc all people do game mode hover till gauntlet drops drop like tilted towers ,993885187594432512,,,,None
im not excited about dlc either arbys ,993885149849948161,,,,None
enter 2 ps4 pro giveaway ,993885112336113665,,,,None
keep moving forward god getting ready destiny ,993885108938698752,,,,None
know ,993885105402753024,,,,None
time are best friends meet every fuking thing possible ,993885104622653440,,,,None
covenant keeping god  cant love less  he all sufficient god  changer  miracle worker  yaaasshhhhhhhh ,993885069516386304,,,,None
live youtube link bio come have fun ,993885066555150336,,,,None
warmind waiting room come hang chat figure how kill time couple hours ,993885024733704192,,,,None
2 expansion ,993885012347969536,,,,None
compass points destiny no looking back take helm with me ,993885011882340352,,,,None
1st amp 2nd customer ,993885005590999040,,,,None
yeah hype real game still hoping join guys well but main priority play lots 2 try content  ,993884993800818693,,,,None
myoui mina heshe are hisher destiny ,993884961663942656,,,,None
check broadcast playstation 4 2 live ,993884948099731457,,,,None
envision destiny ,993884937626382336,,,,None
stopped streaming some reason streaming tarkov tanked fps today unsure why back with later ,993884904143323136,,,,None
2 warmind expansion now gets launch trailer ,993884890088255489,,,,None
so whos jackass scheduled maintenance day 2nd expansion comes 2 would consider epic fail ,993884883062734848,,,,None
pre ordered 2 played launch got 305 power did raid but felt like wasnt anything left game wasnt grindy curse dropped played it beat it havent touched 2 since gonna play one really hope pulls ,993884855057477632,,,,None
cant believe im excited related again had lost so much love franchise you but dont let down ,993884847914541056,,,,None
